{
  "id": "mvp1",
  "version": "1.0.0",
  "grid": { "cols": 6, "rows": [3, 4, 5, 5, 4, 3] },
  "reels": [
    [["H1",1],["H2",2],["H3",3],["L1",6],["L2",8],["L3",10],["L4",12],["WILD",1],["SCAT",1]],
    [["H1",1],["H2",2],["H3",3],["L1",6],["L2",8],["L3",10],["L4",12],["WILD",1],["SCAT",1]],
    [["H1",1],["H2",2],["H3",3],["L1",6],["L2",8],["L3",10],["L4",12],["WILD",1],["SCAT",1]],
    [["H1",1],["H2",2],["H3",3],["L1",6],["L2",8],["L3",10],["L4",12],["WILD",1],["SCAT",1]],
    [["H1",1],["H2",2],["H3",3],["L1",6],["L2",8],["L3",10],["L4",12],["WILD",1],["SCAT",1]],
    [["H1",1],["H2",2],["H3",3],["L1",6],["L2",8],["L3",10],["L4",12],["WILD",1],["SCAT",1]]
  ],
  "paytable": {
    "H1": { "6": 100 },
    "H2": { "6":  50 },
    "H3": { "6":  25 },
    "L1": { "6":  10 },
    "L2": { "6":   8 },
    "L3": { "6":   6 },
    "L4": { "6":   4 }
  },
  "scalar": 0.016942,
  "evaluation": "ways",
  "anchor": "leftmost",
  "k_min": 6,
  "scatter": { "enabled": true, "counted_in_base": false },
  "cascade": { "enabled": false, "removal": "none" },
  "wild": { "enabled": true, "substitutes": ["H1","H2","H3","L1","L2","L3","L4"], "counts_as_win": false },
  "bet": { "cost": 1.0, "unit": "per_spin" },
  "pseudocode": "for each paid symbol s: count occurrences in each reel window (with WILD substituting); k = longest leftmost-anchored prefix where count[reel]>=1; if k<k_min skip; ways = product(count[reel]) for reel in 0..k-1; pay += paytable[s][k] * ways * scalar.",
  "target_rtp": 0.96,
  "seed": 20260510,
  "spins": 10000000
}
